<?xml version="1.0" encoding="utf-8"?>
<NationalParks xmlns:xsi="http://www.w3.org/2001/XMLSchema-instance"
               xsi:noNamespaceSchemaLocation="https://raw.githubusercontent.com/YOUR_USERNAME/YOUR_REPO/main/NationalParks.xsd">

  <NationalPark ID="NP-01" Rating="4.9">
    <Name>Grand Canyon</Name>
    <Phone>928-638-7496</Phone>
    <Phone>888-297-2757</Phone>
    <Phone>866-499-2574</Phone>
    <Address NearestAirport="FlagStaff">
      <Number>8</Number>
      <Street>S Entrance Road</Street>
      <City>Grand Canyon</City>
      <State>AZ</State>
      <Zip>86023</Zip>
    </Address>
  </NationalPark>

  <NationalPark ID="NP-02" Rating="4.8">
    <Name>Yellowstone</Name>
    <Phone>307-344-7381</Phone>
    <Phone>307-344-2107</Phone>
    <Address NearestAirport="Yellowstone Regional Airport">
      <Number>2</Number>
      <Street>Officer Row</Street>
      <City>Yellowstone National Park</City>
      <State>WY</State>
      <Zip>82190</Zip>
    </Address>
  </NationalPark>

  <NationalPark ID="NP-03" Rating="4.9">
    <Name>Yosemite</Name>
    <Phone>209-372-0200</Phone>
    <Phone>209-372-4726</Phone>
    <Address>
      <Number>9035</Number>
      <Street>Village Drive</Street>
      <City>Yosemite Valley</City>
      <State>CA</State>
      <Zip>95389</Zip>
    </Address>
  </NationalPark>

  <NationalPark ID="NP-04" Rating="4.8">
    <Name>Zion</Name>
    <Phone>435-772-3256</Phone>
    <Address NearestAirport="St. George Regional Airport">
      <Number>1</Number>
      <Street>Zion Park Blvd</Street>
      <City>Springdale</City>
      <State>UT</State>
      <Zip>84767</Zip>
    </Address>
  </NationalPark>

  <NationalPark ID="NP-05">
    <Name>Rocky Mountain</Name>
    <Phone>970-586-1206</Phone>
    <Phone>970-586-1242</Phone>
    <Address NearestAirport="Denver International Airport">
      <Number>1000</Number>
      <Street>US Highway 36</Street>
      <City>Estes Park</City>
      <State>CO</State>
      <Zip>80517</Zip>
    </Address>
  </NationalPark>

  <NationalPark ID="NP-06" Rating="4.7">
    <Name>Acadia</Name>
    <Phone>207-288-3338</Phone>
    <Address>
      <Number>25</Number>
      <Street>Visitor Center Road</Street>
      <City>Bar Harbor</City>
      <State>ME</State>
      <Zip>04609</Zip>
    </Address>
  </NationalPark>

  <NationalPark ID="NP-07" Rating="4.8">
    <Name>Great Smoky Mountains</Name>
    <Phone>865-436-1200</Phone>
    <Phone>865-436-1294</Phone>
    <Address NearestAirport="McGhee Tyson Airport">
      <Number>107</Number>
      <Street>Park Headquarters Road</Street>
      <City>Gatlinburg</City>
      <State>TN</State>
      <Zip>37738</Zip>
    </Address>
  </NationalPark>

  <NationalPark ID="NP-08">
    <Name>Olympic</Name>
    <Phone>360-565-3130</Phone>
    <Address>
      <Number>3002</Number>
      <Street>Mount Angeles Road</Street>
      <City>Port Angeles</City>
      <State>WA</State>
      <Zip>98362</Zip>
    </Address>
  </NationalPark>

  <NationalPark ID="NP-09" Rating="4.6">
    <Name>Joshua Tree</Name>
    <Phone>760-367-5500</Phone>
    <Phone>760-367-5522</Phone>
    <Address NearestAirport="Palm Springs International Airport">
      <Number>74485</Number>
      <Street>National Park Drive</Street>
      <City>Twentynine Palms</City>
      <State>CA</State>
      <Zip>92277</Zip>
    </Address>
  </NationalPark>

  <NationalPark ID="NP-10" Rating="4.9">
    <Name>Glacier</Name>
    <Phone>406-888-7800</Phone>
    <Address NearestAirport="Glacier Park International Airport">
      <Number>64</Number>
      <Street>Grinnell Drive</Street>
      <City>West Glacier</City>
      <State>MT</State>
      <Zip>59936</Zip>
    </Address>
  </NationalPark>

  <NationalPark ID="NP-11">
    <Name>Shenandoah</Name>
    <Phone>540-999-3500</Phone>
    <Phone>540-999-3488</Phone>
    <Address>
      <Number>3655</Number>
      <Street>US Highway 211 East</Street>
      <City>Luray</City>
      <State>VA</State>
      <Zip>22835</Zip>
    </Address>
  </NationalPark>

  <NationalPark ID="NP-12" Rating="4.8">
    <Name>Bryce Canyon</Name>
    <Phone>435-834-5322</Phone>
    <Address NearestAirport="Cedar City Regional Airport">
      <Number>1</Number>
      <Street>Bryce Canyon National Park Road</Street>
      <City>Bryce Canyon City</City>
      <State>UT</State>
      <Zip>84764</Zip>
    </Address>
  </NationalPark>

</NationalParks>